attack_vector,business_impact,business_risk_score,capec_id,compliance_impact,cwe_id,date_identified,date_last_updated,description,dread_score,evidence,exploitability,id,identified_by,impact_severity,impacted_asset_ids,impacted_component_ids,impacted_data_flow_ids,mitigations,owner,prerequisites,related_threat_ids,residual_risk,status,stride_category,title
,,,,,,2025-09-27 16:11:22.992338,2025-09-27 16:11:22.992344,An attacker may exploit weak authentication mechanisms in the API Gateway to gain unauthorized access to the application.,"{'damage': 1, 'reproducibility': 1, 'exploitability': 1, 'affected_users': 1, 'discoverability': 1}",,Exploitability.MODERATE,01K65Z2YZGFW4MPM3WHD4EN5M0,,ImpactSeverity.MEDIUM,,,,,,,,,ThreatStatus.IDENTIFIED,spoofing,Unauthorized Access to API
,,,,,,2025-09-27 16:11:22.992502,2025-09-27 16:11:22.992507,"Search queries or logs could be intercepted and altered during transmission between components, leading to incorrect data processing.","{'damage': 1, 'reproducibility': 1, 'exploitability': 1, 'affected_users': 1, 'discoverability': 1}",,Exploitability.MODERATE,01K65Z2YZGQG61BJET8XC5NESJ,,ImpactSeverity.MEDIUM,,,,,,,,,ThreatStatus.IDENTIFIED,tampering,Data Tampering in Transit
,,,,,,2025-09-27 16:11:22.992851,2025-09-27 16:11:22.992856,"Users may deny having performed certain actions if adequate logging and tracking mechanisms are not in place, complicating accountability.","{'damage': 1, 'reproducibility': 1, 'exploitability': 1, 'affected_users': 1, 'discoverability': 1}",,Exploitability.MODERATE,01K65Z2YZGBWQ0W7NPSB6WV75P,,ImpactSeverity.MEDIUM,,,,,,,,,ThreatStatus.IDENTIFIED,repudiation,Repudiation of Actions
,,,,,,2025-09-27 16:11:22.993027,2025-09-27 16:11:22.993032,Improper handling or storage of sensitive user data could lead to unauthorized access and exposure of personal information.,"{'damage': 1, 'reproducibility': 1, 'exploitability': 1, 'affected_users': 1, 'discoverability': 1}",,Exploitability.MODERATE,01K65Z2YZHTWDHE71V3QC0DR94,,ImpactSeverity.MEDIUM,,,,,,,,,ThreatStatus.IDENTIFIED,information_disclosure,Sensitive Data Exposure
,,,,,,2025-09-27 16:11:22.993148,2025-09-27 16:11:22.993152,"An attacker could overwhelm the API Gateway or other components with excessive requests, leading to service unavailability.","{'damage': 1, 'reproducibility': 1, 'exploitability': 1, 'affected_users': 1, 'discoverability': 1}",,Exploitability.MODERATE,01K65Z2YZHZBQ794GBTEF9P4TF,,ImpactSeverity.MEDIUM,,,,,,,,,ThreatStatus.IDENTIFIED,denial_of_service,Denial of Service Attack
,,,,,,2025-09-27 16:11:22.993273,2025-09-27 16:11:22.993277,"If AWS Lambda functions are not properly secured, an attacker could exploit them to gain elevated access to other AWS resources.","{'damage': 1, 'reproducibility': 1, 'exploitability': 1, 'affected_users': 1, 'discoverability': 1}",,Exploitability.MODERATE,01K65Z2YZHJ13168756BBEQEHB,,ImpactSeverity.MEDIUM,,,,,,,,,ThreatStatus.IDENTIFIED,elevation_of_privilege,Elevation of Privilege via Lambda Functions
,,,,,,2025-09-27 16:11:22.995475,2025-09-27 16:11:22.995483,"Improper validation of user input could lead to injection attacks, such as SQL injection or command injection, affecting data integrity.","{'damage': 1, 'reproducibility': 1, 'exploitability': 1, 'affected_users': 1, 'discoverability': 1}",,Exploitability.MODERATE,01K65Z2YZKH00D6HJGM96F10K9,,ImpactSeverity.MEDIUM,,,,,,,,,ThreatStatus.IDENTIFIED,tampering,Input Validation Attacks
