attack_vector,business_impact,business_risk_score,capec_id,compliance_impact,cwe_id,date_identified,date_last_updated,description,dread_score,evidence,exploitability,id,identified_by,impact_severity,impacted_asset_ids,impacted_component_ids,impacted_data_flow_ids,mitigations,owner,prerequisites,related_threat_ids,residual_risk,status,stride_category,title
,,,,,,2025-09-28 06:22:08.583352,2025-09-28 06:22:08.583360,"An attacker could inject malicious commands through the CLI frontend if input validation is insufficient, leading to unauthorized actions during the build process.","{'damage': 1, 'reproducibility': 1, 'exploitability': 1, 'affected_users': 1, 'discoverability': 1}",,Exploitability.MODERATE,01K67FRR650CK3FWSZEV6BZR5Q,,ImpactSeverity.MEDIUM,,,,,,,,,ThreatStatus.IDENTIFIED,tampering,CLI Command Injection via Unvalidated Inputs
,,,,,,2025-09-28 06:22:08.602033,2025-09-28 06:22:08.602048,"An attacker might spoof the CLI frontend to trick users into executing malicious build scripts or configurations, compromising the build system.","{'damage': 1, 'reproducibility': 1, 'exploitability': 1, 'affected_users': 1, 'discoverability': 1}",,Exploitability.MODERATE,01K67FRR6S3R1HW9HFRB7RA1YR,,ImpactSeverity.MEDIUM,,,,,,,,,ThreatStatus.IDENTIFIED,spoofing,Spoofed CLI Frontend Execution
,,,,,,2025-09-28 06:22:08.604261,2025-09-28 06:22:08.604272,"Sensitive package metadata exchanged between the Build System and Package Manager could be intercepted if not encrypted, leading to information disclosure.","{'damage': 1, 'reproducibility': 1, 'exploitability': 1, 'affected_users': 1, 'discoverability': 1}",,Exploitability.MODERATE,01K67FRR6VZT2DQV2GBRR5WFCW,,ImpactSeverity.MEDIUM,,,,,,,,,ThreatStatus.IDENTIFIED,information_disclosure,Unencrypted Package Metadata Transmission
,,,,,,2025-09-28 06:22:08.604705,2025-09-28 06:22:08.604718,"A vulnerability in the Package Manager integration could allow an attacker to escalate privileges, gaining unauthorized control over dependency resolution.","{'damage': 1, 'reproducibility': 1, 'exploitability': 1, 'affected_users': 1, 'discoverability': 1}",,Exploitability.MODERATE,01K67FRR6WK34JCA9YFT1HDFWT,,ImpactSeverity.MEDIUM,,,,,,,,,ThreatStatus.IDENTIFIED,elevation_of_privilege,Elevation of Privilege via Package Manager Vulnerabilities
,,,,,,2025-09-28 06:22:08.609269,2025-09-28 06:22:08.609310,"An attacker could exhaust system resources (e.g., memory, CPU) during the build process, causing the Build System to become unavailable.","{'damage': 1, 'reproducibility': 1, 'exploitability': 1, 'affected_users': 1, 'discoverability': 1}",,Exploitability.MODERATE,01K67FRR709VAHSJQQM7445YHV,,ImpactSeverity.MEDIUM,,,,,,,,,ThreatStatus.IDENTIFIED,denial_of_service,Denial of Service via Resource Exhaustion
