attack_vector,business_impact,business_risk_score,capec_id,compliance_impact,cwe_id,date_identified,date_last_updated,description,dread_score,evidence,exploitability,id,identified_by,impact_severity,impacted_asset_ids,impacted_component_ids,impacted_data_flow_ids,mitigations,owner,prerequisites,related_threat_ids,residual_risk,status,stride_category,title
,,,,,,2025-09-27 21:28:56.326047,2025-09-27 21:28:56.326055,An attacker could gain unauthorized access to the application by exploiting weak authentication mechanisms or misconfigured access controls.,"{'damage': 1, 'reproducibility': 1, 'exploitability': 1, 'affected_users': 1, 'discoverability': 1}",,Exploitability.MODERATE,01K66H8DR5530T415SFY3KGS4X,,ImpactSeverity.MEDIUM,,,,,,,,,ThreatStatus.IDENTIFIED,spoofing,Unauthorized Access
,,,,,,2025-09-27 21:28:56.326309,2025-09-27 21:28:56.326316,"An attacker could manipulate data in transit or at rest, potentially altering the results of research tasks or configurations.","{'damage': 1, 'reproducibility': 1, 'exploitability': 1, 'affected_users': 1, 'discoverability': 1}",,Exploitability.MODERATE,01K66H8DR6Q9QKX0CWGPPVA3XF,,ImpactSeverity.MEDIUM,,,,,,,,,ThreatStatus.IDENTIFIED,tampering,Data Tampering
,,,,,,2025-09-27 21:28:56.326469,2025-09-27 21:28:56.326476,Sensitive information such as API keys or user data could be exposed due to improper configuration or lack of encryption.,"{'damage': 1, 'reproducibility': 1, 'exploitability': 1, 'affected_users': 1, 'discoverability': 1}",,Exploitability.MODERATE,01K66H8DR65RQTG13X4GV294MM,,ImpactSeverity.MEDIUM,,,,,,,,,ThreatStatus.IDENTIFIED,information_disclosure,Information Disclosure
,,,,,,2025-09-27 21:28:56.326608,2025-09-27 21:28:56.326614,"An attacker could overwhelm the application with excessive requests, leading to service unavailability for legitimate users.","{'damage': 1, 'reproducibility': 1, 'exploitability': 1, 'affected_users': 1, 'discoverability': 1}",,Exploitability.MODERATE,01K66H8DR6MRQC8M3C8ENXWBPY,,ImpactSeverity.MEDIUM,,,,,,,,,ThreatStatus.IDENTIFIED,denial_of_service,Denial of Service (DoS)
,,,,,,2025-09-27 21:28:56.326730,2025-09-27 21:28:56.326736,"The application may be vulnerable to injection attacks (e.g., SQL injection, command injection) if user inputs are not properly validated and sanitized.","{'damage': 1, 'reproducibility': 1, 'exploitability': 1, 'affected_users': 1, 'discoverability': 1}",,Exploitability.MODERATE,01K66H8DR68FH4B9AY9N7PY862,,ImpactSeverity.MEDIUM,,,,,,,,,ThreatStatus.IDENTIFIED,tampering,Input Validation Attacks
,,,,,,2025-09-27 21:28:56.326851,2025-09-27 21:28:56.326856,"Users may deny performing actions if there is no proper logging and auditing mechanism in place, leading to accountability issues.","{'damage': 1, 'reproducibility': 1, 'exploitability': 1, 'affected_users': 1, 'discoverability': 1}",,Exploitability.MODERATE,01K66H8DR6P9ZKADCV6ZWEDPMW,,ImpactSeverity.MEDIUM,,,,,,,,,ThreatStatus.IDENTIFIED,repudiation,Repudiation of Actions
,,,,,,2025-09-27 21:28:56.326979,2025-09-27 21:28:56.326984,"A user may exploit vulnerabilities to gain higher privileges than intended, allowing them to access restricted functionalities.","{'damage': 1, 'reproducibility': 1, 'exploitability': 1, 'affected_users': 1, 'discoverability': 1}",,Exploitability.MODERATE,01K66H8DR65ME86F4AWPJ2W57T,,ImpactSeverity.MEDIUM,,,,,,,,,ThreatStatus.IDENTIFIED,elevation_of_privilege,Elevation of Privilege
