attack_vector,business_impact,business_risk_score,capec_id,compliance_impact,cwe_id,date_identified,date_last_updated,description,dread_score,evidence,exploitability,id,identified_by,impact_severity,impacted_asset_ids,impacted_component_ids,impacted_data_flow_ids,mitigations,owner,prerequisites,related_threat_ids,residual_risk,status,stride_category,title
,,,,,,2025-09-27 04:00:17.893609,2025-09-27 04:00:17.893616,An attacker could gain unauthorized access to the application by exploiting weak authentication mechanisms or session management flaws.,"{'damage': 1, 'reproducibility': 1, 'exploitability': 1, 'affected_users': 1, 'discoverability': 1}",,Exploitability.MODERATE,01K64N89Z5ME8M4FXE2BZQ8BT4,,ImpactSeverity.MEDIUM,,,,,,,,,ThreatStatus.IDENTIFIED,spoofing,Unauthorized Access
,,,,,,2025-09-27 04:00:17.895447,2025-09-27 04:00:17.895458,Sensitive data such as screenshots or user information could be exposed due to improper access controls or insecure data storage practices.,"{'damage': 1, 'reproducibility': 1, 'exploitability': 1, 'affected_users': 1, 'discoverability': 1}",,Exploitability.MODERATE,01K64N89Z6ENR82YS68EZTPVVM,,ImpactSeverity.MEDIUM,,,,,,,,,ThreatStatus.IDENTIFIED,information_disclosure,Data Leakage
,,,,,,2025-09-27 04:00:17.895912,2025-09-27 04:00:17.895917,"The application may be vulnerable to injection attacks (e.g., code injection, command injection) if user inputs are not properly validated or sanitized.","{'damage': 1, 'reproducibility': 1, 'exploitability': 1, 'affected_users': 1, 'discoverability': 1}",,Exploitability.MODERATE,01K64N89Z71131XSKMT065BKC5,,ImpactSeverity.MEDIUM,,,,,,,,,ThreatStatus.IDENTIFIED,tampering,Malicious Input Handling
,,,,,,2025-09-27 04:00:17.896074,2025-09-27 04:00:17.896077,"An attacker could overwhelm the application with excessive requests, leading to service unavailability for legitimate users.","{'damage': 1, 'reproducibility': 1, 'exploitability': 1, 'affected_users': 1, 'discoverability': 1}",,Exploitability.MODERATE,01K64N89Z8CE2GTYR1M2R46HPB,,ImpactSeverity.MEDIUM,,,,,,,,,ThreatStatus.IDENTIFIED,denial_of_service,Denial of Service Attack
,,,,,,2025-09-27 04:00:17.896857,2025-09-27 04:00:17.896861,An attacker could exploit session management vulnerabilities to hijack user sessions by fixing a user's session ID.,"{'damage': 1, 'reproducibility': 1, 'exploitability': 1, 'affected_users': 1, 'discoverability': 1}",,Exploitability.MODERATE,01K64N89Z8AW6HTA5XCWF148PY,,ImpactSeverity.MEDIUM,,,,,,,,,ThreatStatus.IDENTIFIED,elevation_of_privilege,Session Fixation
,,,,,,2025-09-27 04:00:17.896966,2025-09-27 04:00:17.896969,Improper handling of file paths or permissions could allow attackers to access sensitive files on the server or client device.,"{'damage': 1, 'reproducibility': 1, 'exploitability': 1, 'affected_users': 1, 'discoverability': 1}",,Exploitability.MODERATE,01K64N89Z8M6HEWJ68V27R7SV1,,ImpactSeverity.MEDIUM,,,,,,,,,ThreatStatus.IDENTIFIED,information_disclosure,File System Exposure
