attack_vector,business_impact,business_risk_score,capec_id,compliance_impact,cwe_id,date_identified,date_last_updated,description,dread_score,evidence,exploitability,id,identified_by,impact_severity,impacted_asset_ids,impacted_component_ids,impacted_data_flow_ids,mitigations,owner,prerequisites,related_threat_ids,residual_risk,status,stride_category,title
,,,,,,2025-09-27 14:46:09.820475,2025-09-27 14:46:09.820490,"An attacker could gain unauthorized access to captured screenshots stored on the device, leading to sensitive information exposure.","{'damage': 1, 'reproducibility': 1, 'exploitability': 1, 'affected_users': 1, 'discoverability': 1}",,Exploitability.MODERATE,01K65T6XMM99TJ9HVJFTRGTXWM,,ImpactSeverity.MEDIUM,,,,,,,,,ThreatStatus.IDENTIFIED,spoofing,Unauthorized Access to Screenshots
,,,,,,2025-09-27 14:46:09.831698,2025-09-27 14:46:09.831719,"Screenshots may be stored insecurely on the device, making them accessible to malicious applications or users.","{'damage': 1, 'reproducibility': 1, 'exploitability': 1, 'affected_users': 1, 'discoverability': 1}",,Exploitability.MODERATE,01K65T6XN7STYZ3WH6GTVREF8Z,,ImpactSeverity.MEDIUM,,,,,,,,,ThreatStatus.IDENTIFIED,information_disclosure,Insecure File Storage
,,,,,,2025-09-27 14:46:09.841129,2025-09-27 14:46:09.841136,Improper validation of input parameters for screenshot strategies could allow an attacker to inject malicious code or commands.,"{'damage': 1, 'reproducibility': 1, 'exploitability': 1, 'affected_users': 1, 'discoverability': 1}",,Exploitability.MODERATE,01K65T6XNGGTGWASV5GR3CY16P,,ImpactSeverity.MEDIUM,,,,,,,,,ThreatStatus.IDENTIFIED,tampering,Injection Attacks via Input Parameters
,,,,,,2025-09-27 14:46:09.860137,2025-09-27 14:46:09.860145,"An attacker could trigger excessive screenshot captures, leading to resource exhaustion and denial of service for legitimate users.","{'damage': 1, 'reproducibility': 1, 'exploitability': 1, 'affected_users': 1, 'discoverability': 1}",,Exploitability.MODERATE,01K65T6XP4P23D63KWR8FWHDAY,,ImpactSeverity.MEDIUM,,,,,,,,,ThreatStatus.IDENTIFIED,denial_of_service,Denial of Service via Resource Exhaustion
,,,,,,2025-09-27 14:46:09.862905,2025-09-27 14:46:09.863308,"An attacker could replay valid screenshot commands to capture unauthorized screenshots, leading to information leakage.","{'damage': 1, 'reproducibility': 1, 'exploitability': 1, 'affected_users': 1, 'discoverability': 1}",,Exploitability.MODERATE,01K65T6XP6QHZMCVWF60GGNX1N,,ImpactSeverity.MEDIUM,,,,,,,,,ThreatStatus.IDENTIFIED,repudiation,Replay Attacks on Screenshot Commands
,,,,,,2025-09-27 14:46:09.863876,2025-09-27 14:46:09.863879,Improperly configured permissions could allow a malicious user to execute screenshot commands that should be restricted.,"{'damage': 1, 'reproducibility': 1, 'exploitability': 1, 'affected_users': 1, 'discoverability': 1}",,Exploitability.MODERATE,01K65T6XP7VG26FQSERBN800T2,,ImpactSeverity.MEDIUM,,,,,,,,,ThreatStatus.IDENTIFIED,elevation_of_privilege,Elevation of Privilege through Misconfigured Permissions
