attack_vector,business_impact,business_risk_score,capec_id,compliance_impact,cwe_id,date_identified,date_last_updated,description,dread_score,evidence,exploitability,id,identified_by,impact_severity,impacted_asset_ids,impacted_component_ids,impacted_data_flow_ids,mitigations,owner,prerequisites,related_threat_ids,residual_risk,status,stride_category,title
,,,,,,2025-09-27 15:56:54.487765,2025-09-27 15:56:54.487775,An attacker can manipulate SQL queries through user input to gain unauthorized access to the database or retrieve sensitive data.,"{'damage': 1, 'reproducibility': 1, 'exploitability': 1, 'affected_users': 1, 'discoverability': 1}",,Exploitability.MODERATE,01K65Y8ETPKNEJXDF6PX4TC8PN,,ImpactSeverity.MEDIUM,,,,,,,,,ThreatStatus.IDENTIFIED,tampering,SQL Injection
,,,,,,2025-09-27 15:56:54.488423,2025-09-27 15:56:54.488434,"An attacker can inject malicious scripts into web pages viewed by users, potentially stealing cookies or session tokens.","{'damage': 1, 'reproducibility': 1, 'exploitability': 1, 'affected_users': 1, 'discoverability': 1}",,Exploitability.MODERATE,01K65Y8ETR6C3FHP08F4K6PHVY,,ImpactSeverity.MEDIUM,,,,,,,,,ThreatStatus.IDENTIFIED,tampering,Cross-Site Scripting (XSS)
,,,,,,2025-09-27 15:56:54.488809,2025-09-27 15:56:54.488814,"Weak authentication mechanisms may allow attackers to steal user credentials, leading to unauthorized access.","{'damage': 1, 'reproducibility': 1, 'exploitability': 1, 'affected_users': 1, 'discoverability': 1}",,Exploitability.MODERATE,01K65Y8ETRE44NYVTV4DSD32R4,,ImpactSeverity.MEDIUM,,,,,,,,,ThreatStatus.IDENTIFIED,spoofing,Credential Theft
,,,,,,2025-09-27 15:56:54.489058,2025-09-27 15:56:54.489062,"Sensitive data may be exposed due to improper access controls or lack of encryption, leading to information disclosure.","{'damage': 1, 'reproducibility': 1, 'exploitability': 1, 'affected_users': 1, 'discoverability': 1}",,Exploitability.MODERATE,01K65Y8ETSFGBQT6VYZ5XSKQBF,,ImpactSeverity.MEDIUM,,,,,,,,,ThreatStatus.IDENTIFIED,information_disclosure,Data Exposure
,,,,,,2025-09-27 15:56:54.489280,2025-09-27 15:56:54.489285,"An attacker can overwhelm the application with excessive requests, causing service unavailability.","{'damage': 1, 'reproducibility': 1, 'exploitability': 1, 'affected_users': 1, 'discoverability': 1}",,Exploitability.MODERATE,01K65Y8ETSSW35S8C0SEGCBAT6,,ImpactSeverity.MEDIUM,,,,,,,,,ThreatStatus.IDENTIFIED,denial_of_service,Denial of Service (DoS)
,,,,,,2025-09-27 15:56:54.489975,2025-09-27 15:56:54.489983,"Insufficient validation of user inputs can lead to various attacks, including injection attacks and buffer overflows.","{'damage': 1, 'reproducibility': 1, 'exploitability': 1, 'affected_users': 1, 'discoverability': 1}",,Exploitability.MODERATE,01K65Y8ETSH45V9E2KZPM4XAS0,,ImpactSeverity.MEDIUM,,,,,,,,,ThreatStatus.IDENTIFIED,tampering,Improper Input Validation
,,,,,,2025-09-27 15:56:54.490399,2025-09-27 15:56:54.490403,"An attacker may exploit vulnerabilities to gain elevated access rights, allowing them to perform unauthorized actions.","{'damage': 1, 'reproducibility': 1, 'exploitability': 1, 'affected_users': 1, 'discoverability': 1}",,Exploitability.MODERATE,01K65Y8ETTJDY5C6FED9V31Z8G,,ImpactSeverity.MEDIUM,,,,,,,,,ThreatStatus.IDENTIFIED,elevation_of_privilege,Privilege Escalation
,,,,,,2025-09-27 15:56:54.490611,2025-09-27 15:56:54.490614,"An attacker can hijack a user's session by stealing session tokens, allowing unauthorized access to the application.","{'damage': 1, 'reproducibility': 1, 'exploitability': 1, 'affected_users': 1, 'discoverability': 1}",,Exploitability.MODERATE,01K65Y8ETT2D68F7FNMGEPPQAQ,,ImpactSeverity.MEDIUM,,,,,,,,,ThreatStatus.IDENTIFIED,spoofing,Session Hijacking
