attack_vector,business_impact,business_risk_score,capec_id,compliance_impact,cwe_id,date_identified,date_last_updated,description,dread_score,evidence,exploitability,id,identified_by,impact_severity,impacted_asset_ids,impacted_component_ids,impacted_data_flow_ids,mitigations,owner,prerequisites,related_threat_ids,residual_risk,status,stride_category,title
,,,,,,2025-09-28 17:58:14.610856,2025-09-28 17:58:14.610862,"Fastlane dynamically loads Ruby gems as plugins. An attacker can supply a malicious plugin or compromise an existing one, allowing arbitrary code execution with the same privileges as the user running Fastlane.","{'damage': 1, 'reproducibility': 1, 'exploitability': 1, 'affected_users': 1, 'discoverability': 1}",,Exploitability.MODERATE,01K68QKBAJ1RKS822Z6NJ6E8MD,,ImpactSeverity.MEDIUM,,,,,,,,,ThreatStatus.IDENTIFIED,elevation_of_privilege,Malicious or Compromised Plugin Execution
,,,,,,2025-09-28 17:58:14.611085,2025-09-28 17:58:14.611088,"Fastlane stores API keys, certificates, and other secrets in local YAML/JSON files and encrypted keychains. If an attacker gains access to the local machine or the encrypted store is weakly protected, these secrets can be exfiltrated and used to impersonate developers or upload malicious binaries.","{'damage': 1, 'reproducibility': 1, 'exploitability': 1, 'affected_users': 1, 'discoverability': 1}",,Exploitability.MODERATE,01K68QKBAKDCYC7QYY40R9RBZH,,ImpactSeverity.MEDIUM,,,,,,,,,ThreatStatus.IDENTIFIED,information_disclosure,Credential Theft from Local Store
,,,,,,2025-09-28 17:58:14.611235,2025-09-28 17:58:14.611238,"Lane definitions are parsed from YAML/JSON files. Improper validation can allow injection of arbitrary Ruby code or command execution, enabling tampering with build processes or unauthorized actions.","{'damage': 1, 'reproducibility': 1, 'exploitability': 1, 'affected_users': 1, 'discoverability': 1}",,Exploitability.MODERATE,01K68QKBAK5TV5PCS09GF8Y8A6,,ImpactSeverity.MEDIUM,,,,,,,,,ThreatStatus.IDENTIFIED,tampering,Injection via Lane Definition Files
,,,,,,2025-09-28 17:58:14.611330,2025-09-28 17:58:14.611333,"Fastlane communicates with external services (Apple, Google, CI/CD, Slack) over HTTPS. If TLS is misconfigured or an attacker can intercept traffic, sensitive data such as credentials or signed binaries could be disclosed or altered.","{'damage': 1, 'reproducibility': 1, 'exploitability': 1, 'affected_users': 1, 'discoverability': 1}",,Exploitability.MODERATE,01K68QKBAKS6BKKC31EERZDXF2,,ImpactSeverity.MEDIUM,,,,,,,,,ThreatStatus.IDENTIFIED,information_disclosure,Man‑in‑the‑Middle on External Service Calls
,,,,,,2025-09-28 17:58:14.611529,2025-09-28 17:58:14.611533,"A plugin could consume excessive CPU, memory, or disk I/O, causing Fastlane or the host system to become unresponsive, disrupting CI pipelines or local development.","{'damage': 1, 'reproducibility': 1, 'exploitability': 1, 'affected_users': 1, 'discoverability': 1}",,Exploitability.MODERATE,01K68QKBAKDTZ85CXM0MD9X263,,ImpactSeverity.MEDIUM,,,,,,,,,ThreatStatus.IDENTIFIED,denial_of_service,Denial of Service via Resource Exhaustion by Plugins
,,,,,,2025-09-28 17:58:14.611735,2025-09-28 17:58:14.611739,"Fastlane does not enforce comprehensive logging of actions performed by plugins or the CLI. This makes it difficult to prove who performed an action, enabling repudiation of malicious or accidental changes.","{'damage': 1, 'reproducibility': 1, 'exploitability': 1, 'affected_users': 1, 'discoverability': 1}",,Exploitability.MODERATE,01K68QKBAKMG9Y3ZQFHRRSJD28,,ImpactSeverity.MEDIUM,,,,,,,,,ThreatStatus.IDENTIFIED,repudiation,Lack of Audit Logging and Repudiation
