attack_vector,business_impact,business_risk_score,capec_id,compliance_impact,cwe_id,date_identified,date_last_updated,description,dread_score,evidence,exploitability,id,identified_by,impact_severity,impacted_asset_ids,impacted_component_ids,impacted_data_flow_ids,mitigations,owner,prerequisites,related_threat_ids,residual_risk,status,stride_category,title
,,,,,,2025-09-28 17:55:49.253607,2025-09-28 17:55:49.253617,"An attacker injects malicious scripts into the frontend application, potentially stealing user data or performing actions on behalf of the user.","{'damage': 1, 'reproducibility': 1, 'exploitability': 1, 'affected_users': 1, 'discoverability': 1}",,Exploitability.MODERATE,01K68QEXC5GCFDWMG1KGSBZK64,,ImpactSeverity.MEDIUM,,,,,,,,,ThreatStatus.IDENTIFIED,spoofing,Cross-Site Scripting (XSS)
,,,,,,2025-09-28 17:55:49.253863,2025-09-28 17:55:49.253866,"Vulnerabilities in the Authentication Service, such as weak passwords, lack of multi-factor authentication, or improper session management, could allow attackers to compromise user accounts.","{'damage': 1, 'reproducibility': 1, 'exploitability': 1, 'affected_users': 1, 'discoverability': 1}",,Exploitability.MODERATE,01K68QEXC57SYAZZMAX95BNK2F,,ImpactSeverity.MEDIUM,,,,,,,,,ThreatStatus.IDENTIFIED,repudiation,Broken Authentication
,,,,,,2025-09-28 17:55:49.253982,2025-09-28 17:55:49.253985,"Attackers inject malicious SQL code into input fields, potentially allowing them to access, modify, or delete data in the Data Service.","{'damage': 1, 'reproducibility': 1, 'exploitability': 1, 'affected_users': 1, 'discoverability': 1}",,Exploitability.MODERATE,01K68QEXC5PH0P561HZKFJ8Q7R,,ImpactSeverity.MEDIUM,,,,,,,,,ThreatStatus.IDENTIFIED,information_disclosure,SQL Injection
,,,,,,2025-09-28 17:55:49.254105,2025-09-28 17:55:49.254108,"Lack of proper input validation on the Frontend and API Gateway allows attackers to submit malicious data that could be processed by backend services, leading to vulnerabilities.","{'damage': 1, 'reproducibility': 1, 'exploitability': 1, 'affected_users': 1, 'discoverability': 1}",,Exploitability.MODERATE,01K68QEXC6AZ7ANJCVZTP7B2NX,,ImpactSeverity.MEDIUM,,,,,,,,,ThreatStatus.IDENTIFIED,tampering,Insufficient Input Validation
,,,,,,2025-09-28 17:55:49.254258,2025-09-28 17:55:49.254271,Sensitive data stored in the Data Service is accessible to unauthorized users due to inadequate access controls or misconfigured security settings.,"{'damage': 1, 'reproducibility': 1, 'exploitability': 1, 'affected_users': 1, 'discoverability': 1}",,Exploitability.MODERATE,01K68QEXC6D091CY8HHHZ5RMBV,,ImpactSeverity.MEDIUM,,,,,,,,,ThreatStatus.IDENTIFIED,information_disclosure,Data Exposure
